{
  "schema_version": "1.2.0",
  "artefact": "probe",
  "artefact_version": 1,
  "analysis_id": "0192f6c4-8b00-7a00-8000-0000000000aa",
  "user_id": "usr_01JB7Q3K9W2F",
  "audio_hash": "f6ea3271a3f5d48649cb7c1741eafdaad1c65e7879536b91dc998068277be630",
  "sample_rate": 44100,
  "duration_s": 20.5,
  "models": [],
  "params": {
    "ffmpeg": "8.1.3",
    "sample_rate": 44100,
    "channels": 2,
    "max_duration_s": 1200
  },
  "created_at": "2026-10-20T12:00:02Z",
  "container": "mov,mp4,m4a,3gp,3g2,mj2",
  "source_bytes": 412311,
  "source_sha256": "3a7bd3e2360a3d29eea436fcfb7e44c735d117c42d1c1835420b6b9942dd4f1b",
  "source_duration_s": 20.526,
  "audio_streams": 1,
  "audio_stream": {
    "codec": "aac",
    "sample_rate": 48000,
    "channels": 2,
    "channel_layout": "stereo",
    "bit_rate": 160000,
    "duration_s": 20.526
  },
  "decoded_frames": 904050,
  "loudness_lufs": -11.8,
  "peak_dbfs": -0.6
}
